<?xml version="1.0" encoding="UTF-8" ?>
<!DOCTYPE ldml SYSTEM "../../common/dtd/ldml.dtd">
<!--
SPDX-License-Identifier: MIT
Copyright (c) 2026 Sirac Ozmen
-->
<ldml>
	<identity>
		<version number="$Revision$"/>
		<language type="xx"/>
	</identity>
	<localeDisplayNames>
		<languages>
			<language type="de">Deutsch</language>
			<language type="en">English</language>
			<language type="en" menu="core">English (core)</language>
		</languages>
	</localeDisplayNames>
	<layout>
		<orientation characters="right-to-left" lines="top-to-bottom"/>
	</layout>
	<characters>
		<exemplarCharacters type="index">[A B {CH} \u0110 C D-F]</exemplarCharacters>
	</characters>
	<dates>
		<calendars>
			<calendar type="gregorian">
				<months>
					<monthContext type="format">
						<monthWidth type="wide">
							<month type="1">January</month>
							<month type="2">February</month>
						</monthWidth>
					</monthContext>
				</months>
			</calendar>
		</calendars>
	</dates>
	<numbers>
		<symbols numberSystem="latn">
			<decimal>,</decimal>
			<group>.</group>
		</symbols>
	</numbers>
	<units>
		<unitLength type="short">
			<unit type="duration-hour">
				<displayName>hr</displayName>
				<unitPattern count="one">{0} hr</unitPattern>
				<unitPattern count="other">{0} hrs</unitPattern>
			</unit>
		</unitLength>
	</units>
</ldml>
