<?xml version="1.0" encoding="UTF-8" ?>
<!DOCTYPE ldml SYSTEM "../../common/dtd/ldml.dtd">
<!--
SPDX-License-Identifier: MIT
Copyright (c) 2026 Sirac Ozmen
-->
<ldml>
	<identity>
		<version number="$Revision$"/>
		<language type="root"/>
	</identity>
	<dates>
		<calendars>
			<calendar type="buddhist">
				<months>
					<alias source="locale" path="../../calendar[@type='gregorian']/months"/>
				</months>
			</calendar>
			<calendar type="gregorian">
				<months>
					<monthContext type="format">
						<monthWidth type="abbreviated">
							<alias source="locale" path="../monthWidth[@type='wide']"/>
						</monthWidth>
						<monthWidth type="wide">
							<month type="1">M01</month>
							<month type="2">M02</month>
						</monthWidth>
					</monthContext>
					<monthContext type="stand-alone">
						<monthWidth type="abbreviated">
							<alias source="locale" path="../../monthContext[@type='format']/monthWidth[@type='abbreviated']"/>
						</monthWidth>
					</monthContext>
				</months>
			</calendar>
		</calendars>
	</dates>
	<numbers>
		<symbols numberSystem="latn">
			<decimal>.</decimal>
			<group>,</group>
			<nan>NaN</nan>
		</symbols>
	</numbers>
	<units>
		<unitLength type="narrow">
			<alias source="locale" path="../unitLength[@type='short']"/>
		</unitLength>
	</units>
</ldml>
